type,text
0,"广东省高级人民法院
行 政 判 决 书
（2016）粤行终1735号
上诉人（原审原告）：林红，女，1956年5月5日出生，汉族，住广东省珠海市香洲区。
上诉人（原审原告）：谭震，男，1955年4月20日出生，汉族，系上诉人林红的丈夫，住址同上。
被上诉人（原审被告）：广东省中医药局。住所地：广东省广州市越秀区东风中路483号24楼。
法定代表人：徐庆锋，局长。
被上诉人（原审被告）：广东省卫生和计划生育委员会。住所地：广东省广州市先烈南路17号。
法定代表人：ＸＸ胜，主任。
委托代理人：谭晓莉，广东启源律师事务所律师。
上诉人林红、谭震因诉被上诉人广东省中医药局、广东省卫生和计划生育委员会（以下简称广东省卫计委）不履行法定职责及行政复议纠纷一案，不服广东省广州市中级人民法院（2015）穗中法行初字第328号行政判决，向本院提起上诉。本院依法组成合议庭对本案进行了审理，现已审理终结。
原审法院经审理查明，2015年4月20日，原告林红、谭震向被告广东省中医药局邮寄《查处珠海中医院违反规定书写违法行为申请书》，认为广东省中医药珠海医院（以下简称珠海中医院）违反卫生部规定书写病历，要求省中医药局履行《卫生行政处罚程序》第十五条规定的法定职责，立案调查处理并向原告提供符合《卫生行政处罚程序》、《卫生行政执法文书规范》规定的《立案报告》。
广东省中医药局经查其曾于2014年9月15日收到原告提交的《查处珠海市中医院丁萍主任严重违反〈围手术期管理制度〉违法行为申请书》，后于同年9月19日向原告发出粤中医信[2014]61号《关于对林红、谭震9月13日举报材料的告知函》，其中内容为：“……据了解，林红与珠海中医院的相关医疗纠纷经珠海市医学会和广东省医学会两级医疗事故技术鉴定，结论均不构成医疗事故。2009年林红就医疗纠纷案件，向珠海市香洲区人民法院提起民事诉讼[案号：（2009）香民一初字第1707号]，其中涉及的病历事项也按照民事审判程序正在处理过程中。其后，你们多次将珠海中医院病历和治疗涉嫌违反卫生有关法律法规的事项向珠海市卫生和计划生育局（以下简称珠海卫生计生局）举报，要求珠海卫生计生局对珠海中医院进行卫生行政处罚。珠海卫生计生局于2012年4月5日对举报内容整体打包立案调查并已结案。经调查，珠海卫生计生局认为珠海中医院不存在应予卫生行政处罚的违法事实，并且在2012年出具珠卫函[2012]200号、在2013年出具珠卫函[2013]7号回复函，对你们陆续举报的相应病历事项进行答复。珠海卫生计生局已经对你们多次要求进行行政处罚事项的内容进行整体立案调查并已回复，且没有相应证据证明立案调查结论存在不合法的情况。你们也因同一医疗纠纷事项在珠海法院对珠海卫生计生局和各级行政机关部门提起行政诉讼，共计52宗。就你们针对同一份病历对珠海中医院病历和治疗涉嫌违反卫生有关法律法规事项向我局举报，要求我局对珠海中医院进行行政处罚一事，在长达数年多次投诉、信访、复议的过程中，你们本应向医院所在地卫生行政部门进行举报，但你们仍将《申请书》的举报资料寄送至我局。为避免你们今后将类似申请资料再次寄送我局，现作出如下告知：今后，有新情况、新证据可以证明珠海中医院存在应予卫生行政处罚的事项，你们应向医院所在地的珠海市卫生行政部门举报，珠海市卫生行政部门依职权审查举报事项并依法处理。”遂对原告的本次投诉仅作登记处理。
后原告以广东省中医药局未依《卫生行政处罚程序》第十五条规定应在七日内立案的法定职责，向广东省卫计委申请行政复议。该委经审查，于2015年5月26日作出粤卫行复[2015]20号《驳回行政复议申请决定书》，认为“鉴于珠海卫生计生局已经对申请人（本案原告,下同）要求对珠海中医院进行行政处罚的事项立案调查和处理完毕，且相关事项也在民事诉讼处理过程中，被申请人（本案被告，下同）按此规定可不再受理申请人的申请”，“由于申请人是在没有新证据的情况下，将之前病历材料拆分成多个案件，向不同部门重复提出处理诉求，被申请人收到申请材料后予以登记，并基于当前诉讼进展情况建议待发现新证据、新情况后再行举报投诉，该处理方法符合《广东省信访条例》的上述规定”，根据《中华人民共和国行政复议法实施条例》第四十八条规定，作出涉案粤卫行复(2015)20号《驳回行政复议申请决定书》，驳回原告的行政复议申请。原告收到上述决定书后不服，提起本案诉讼，请求：一、确认被告广东省中医药局对珠海中医院违反规定书写《病历续页第38页》的违法行为拒不履行《卫生行政处罚程序》第十五条规定法定职责的行为违法；二、判令被告广东省中医药局对珠海中医院违反规定书写《病历续页第38页》的违法行为，依照《中医药条例》第六条第二款、《医疗机构管理条例实施细则》第八十九条、《广东省发展中医条例》第五条、《广东省中医药局主要职责内设机构和人员编制规定》的相关规定，行使“监督管理权”、承担“监督管理责任”，履行《卫生行政处罚程序》第十五条规定的法定职责；三、司法建议被告广东省中医药局、广东省卫计委对《病历续页第38页》明智作出客观、专业的“用打印的该病历‘出血量’‘患者病情恶化、送手术室、手术时间’不真实，违反了卫生部2002年《病历书写基本规范(试行)》第三条、第四条规定”的意见；四、撤销被告广东省卫计委粤卫行复[2015]20号《驳回行政复议申请决定书》；五、判令被告广东省卫计委对原告2015年4月18日的行政复议申请重新作出决定。
原审法院经审理认为，《卫生行政处罚程序》第一条规定：“为保证卫生行政机关正确行使行政处罚职权，保护公民、法人和其他组织的合法权益，维护公共利益和社会秩序，根据《行政处罚法》和有关卫生法律、法规的规定，制定本程序。”第二条规定：“本程序所指行政处罚，是指县级以上卫生行政机关依据卫生法律、法规、规章，对应受制裁的违法行为，作出的警告、罚款、没收违法所得、责令停产停业、吊销许可证以及卫生法律、行政法规规定的其他行政处罚。”第十五条规定：“卫生行政机关受理的案件符合下列条件的，应当在七日内立案：（一）有明确的违法行为人或者危害后果；（二）有来源可靠的事实依据；（三）属于卫生行政处罚的范围；（四）属于本机关管辖。卫生行政机关对决定立案的应当制作报告，由直接领导批准，并确定立案日期和两名以上卫生执法人员为承办人。”本案中，就原告对其认为珠海中医院在医疗过程中涉嫌违法的投诉举报，珠海市当地的卫生行政主管部门珠海卫生计生局已进行了调查处理。而原告与医院之间的医疗纠纷民事案件尚处于审理过程中，对医院是否存在医疗过错未有结论。故被告在已就原告因相关医疗纠纷中的有关投诉举报事项予以告知后，仅登记原告本次所提出的申请并无不当。原告仍要求确认被告未履行相应法定职责违法并责令其履行的诉讼请求理据不足，不予支持。
根据《中华人民共和国行政复议法》第三十一条的规定，行政复议机关应当自受理申请之日起六十日内作出行政复议决定。《最高人民法院关于适用〈中华人民共和国行政诉讼法〉若干问题的解释》第九条第一款规定：“复议机关决定维持原行政行为的，人民法院应当在审查原行政行为合法性的同时，一并审查复议程序的合法性。”经审查，被告广东省卫计委作出行政复议决定的程序合法，原告请求撤销被诉行政复议决定的理由不成立，不予采纳。
综上所述，依照《中华人民共和国行政诉讼法》第六十九条的规定，判决：驳回原告林红、谭震的诉讼请求。一审案件受理费50元由原告林红、谭震共同负担。
林红、谭震不服原审判决，向本院提起上诉称，原审判决认定事实不清，适用法律不当。被上诉人的负责人在原审中未出庭应诉，违反有关行政首长出庭应诉的规定。广东省中医药局对珠海中医院拥有监督管理的职责，广东省卫计委不应驳回其行政复议申请。请求二审撤销判决，支持其在原审中提出的全部诉讼请求。
被上诉人广东省中医药局二审辩称，林红、谭震的投诉事项已在珠海卫生计生局立案调查并处理，且在民事诉讼过程中，林红、谭震将病历拆分，重复向广东省中医药局投诉，该局依法应不予受理。广东省中医药局不是适格的被申请主体，且该局在首次收到林红、谭震的举报资料后，已出具相应的告知书，但其无视告知内容，有意向该局继续寄送举报资料，针对同一事项的类似举报目前已累计104份。该局只进行登记，事实依据充分，法律适用正确。原审法院在查明事实基础上所作的判决客观公正，该局对林红、谭震重复举报事项进行登记，已履行相关职责。请求二审驳回上诉，维持原判。
被上诉人广东省卫计委二审辩称，其作出的《驳回行政复议申请决定书》认定事实清楚，证据确凿，适用法律、法规正确，符合法定程序，不存在应当被撤销的情形。原审判决正确，应当予以维持。请求二审驳回上诉，维持原判。
本院二审查明事实与原审基本一致。对原审认定的事实，本院予以确认。
本院认为，林红、谭震因认为珠海中医院在医疗过程中涉嫌违法进行投诉举报，珠海市当地的卫生行政主管部门珠海卫生计生局已进行了调查处理，且其与珠海中医院之间的民事医疗纠纷当时尚处于审理过程中，对医院是否存在医疗过错未有结论。广东省中医药局在已就林红、谭震的有关投诉举报事项予以告知后，对其本次重复投诉举报仅作登记处理并无不当。林红、谭震仍要求确认广东省中医药局未履行相应法定职责违法并责令其履行的诉讼请求理据不足。广东省卫计委作出涉案《驳回行政复议申请决定书》，驳回林红、谭震的行政复议申请并无不当。原审法院认为林红、谭震的诉讼请求不能成立，判决驳回其诉讼请求正确。
综上所述，原审判决认定事实清楚，适用法律正确，程序合法，应予维持。林红、谭震的上诉缺乏充分的事实和法律依据，本院不予支持。依照《中华人民共和国行政诉讼法》第八十九条第一款第（一）项之规定，判决如下：
驳回上诉，维持原判。
二审案件受理费50元，由林红、谭震共同负担。
本判决为终审判决。
审判长　　秦红梅
审判员　　付庆海
审判员　　方丽达

二一六年十二月十五日
书记员　　温　瑜"
