type,text
1,"吉林省高级人民法院
民 事 判 决 书
（2014）吉民提字第58号
再审申请人（一审原告、二审上诉人）：徐艳秋，女，1962年7月24日出生，回族，通化市城管监察支队职员，住吉林省通化市
委托代理人：张东先，吉林易金律师事务所律师。
被申请人（一审被告、二审上诉人）：倪磊，男，1955年9月14日出生，汉族，私营诊所业主，住吉林省通化市
委托代理人：尹波，辽宁罗力彦律师事务所律师。
一审原告、二审上诉人：徐晖，女，1972年9月19日出生，回族，通化市公安局科员，住吉林省通化市
再审申请人徐艳秋因与被申请人倪磊医疗损害责任纠纷一案，不服通化市中级人民法院（2009）通中民一终字第319号民事判决，向本院申请再审。本院于2013年7月9日作出（2013）吉民申字第1114号民事裁定，提审本案。本院依法组成合议庭，公开开庭审理了本案。再审申请人徐艳秋及其委托代理人张东先，被申请人倪磊及其委托代理人尹波到庭参加诉讼。本案现已审理终结。
2008年5月25日，一审原告徐艳秋、徐晖起诉至通化市东昌区人民法院称，2008年3月8日，徐艳秋、徐晖之母洪锦秀因腿肿到被告倪磊处就诊，倪磊对洪锦秀粗略检查后，即收住院治疗，经倪磊对洪锦秀住院治疗19天后，洪锦秀病情加重，生命垂危。徐艳秋、徐晖在不得已的情况下，将洪锦秀转入通化市中心医院抢救治疗。经通化市中心医院对洪锦秀抢救治疗4天，终因医治无效于2008年3月29日死亡。徐艳秋、徐晖认为，倪磊在接收洪锦秀时未明确诊断病情，未对病患详细检查确诊，盲目超量不当使用药物，致使洪锦秀病情加重，导致心、肾及呼吸、循环衰竭，抢救无效死亡。因此，依法应当承担民事赔偿责任，要求倪磊赔偿各项损失156343.96元。
一审被告倪磊辩称，不同意原告徐艳秋、徐晖的诉讼请求。第一、徐艳秋、徐晖的诉请内容不客观，不真实。1、徐艳秋、徐晖之母洪锦秀从未在我诊所住院治疗。2、洪锦秀并非由抢救无效而死亡，其真实的死亡原因是由于没有得到及时的抢救，且被残忍的中止药物治疗，停止呼吸治疗，而造成的死亡。第二，死亡是由于徐艳秋、徐晖的故意造成的，与我方无关。第三、我方的治疗无过错，且未给洪锦秀造成任何伤害，不应承担责任。
通化市东昌区人民法院一审查明，2008年3月8日原告徐艳秋、徐晖之母洪锦秀因病到被告倪磊处就诊，倪磊给洪锦秀的诊断为“右下肢静脉血栓形成、冠心病、房颤、心功能二级、肝硬化、胃底食道静脉破裂结扎术后贫血。”患者洪锦秀前后在倪磊处治疗至3月25日，该日倪磊给洪锦秀做了两份血清检验，3月26日通化市中心医院出具了报告单。洪锦秀于3月26日入住通化市中心医院，3月29日洪锦秀因循环、呼吸衰竭死亡。诉讼后，原告徐艳秋、徐晖申请对其母亲洪锦秀在倪磊处住院治疗的客观资料予以证据保全，法院根据徐艳秋、徐晖的申请，审查认为符合法律规定，裁定对洪锦秀在倪磊处住院治疗的住院病历及相关医疗资料予以证据保全。2008年6月26日，法院在证据保全过程中，要求倪磊提交洪锦秀在其处就诊的全部客观资料，倪磊称无任何客观资料（即病历、病志、处方、检验等），故未收集到任何资料。6月27日，倪磊交来洪锦秀在其处的用药处方复印件12份，其中有一份处方为洪锦秀死亡后的6月25日。7月26日，倪磊交来洪锦秀在其处治疗的门诊手册复印件一份。2008年7月27日，倪磊提交申请，要求对洪锦秀在倪磊西医内科诊所诊治期间的诊断治疗进行医学鉴定。2008年8月10日，通化市中级人民法院以“无病历医学会无法进行鉴定”为由退鉴。2008年11月11日，徐艳秋、徐晖提出申请，要求对洪锦秀的死亡与倪磊的治疗行为是否存在因果关系及过错责任进行鉴定。吉林大众司法鉴定所函告通化市中级人民法院：“经审查卷宗有关材料，对这两项鉴定要求都不能做出鉴定结论意见。其理由是没有对洪锦秀进行尸体解剖检验，没有明确死因。故无法做出死亡与治疗之间是否存在因果关系及过错责任。但该案可作是否存在医疗过错。”2008年12月25日，徐艳秋、徐晖提出对倪磊西医内科诊所在对洪锦秀诊疗过程中是否存在医疗过错进行鉴定。2009年，吉林大众司法鉴定所出具了司法鉴定意见书，“四、分析说明：1、根据通化市东昌区人民法院执行笔录记载及倪磊事后提交的资料中竟出现2008年6月25日的处方签，说明倪磊西医诊所在为洪锦秀诊疗活动中缺乏客观的医疗资料，即病历、病志、处方、检验等。2、倪磊诊所在缺少血管超声实验室检查证据的条件下，仅以右下肢浮肿就诊断洪锦秀患有右下肢静脉血栓形成，属诊断依据不足。3、根据通化市中心医院病历记载，经查体及实验室检查，洪锦秀患有：冠状动脉性心脏病、心功能IV级、肾功能不全、电解质紊乱、肝硬化、贫血、肺感染等，其中大部分病症不是短时间内才出现的。依据询问笔录，在倪磊诊所治疗过程中所使用的药物是：硝普钠、阿司匹林、络活喜、肌苷、维生素倪磊1、倪磊2、肝素、安定、胰岛素、双氢克尿塞、安体疏通等，以硝普钠为首选药。硝普钠为强力血管扩张剂，有肝、肾功能损害的病人大剂量连续使用时，可引起血浆氰化物和硫氰化物浓度升高而中毒，冠状动脉或脑供血不足，肝肾或甲状腺功能不全者慎用，故倪磊诊所为洪锦秀医疗用药属不规范。4、对于身患多种疾病且年老体弱病人的诊疗活动，依照医疗惯例，应该取得实验室检验结果支持，以利于正确诊断、及时治疗及观察病情变化。倪磊诊所为洪锦秀诊疗过程中仅提供了通化市中心医院门诊3月25日的两份血清检验报告单，因此，洪锦秀所患的重症心力衰竭转为终末期心力衰竭并最终死亡与倪磊诊所缺少实验室检查结果支持诊断治疗、观察病情变化，未及时让病人转院治疗存在一定关系，由于倪磊诊所在为洪锦秀诊疗活动中缺乏真实客观的医疗材料，诊疗用药不规范，缺少实验室检查证据，故倪磊诊所在为洪锦秀诊疗活动中存在过错。五、鉴定意见：倪磊西医内科诊所对洪锦秀医疗活动中存在过错。”倪磊不服该鉴定，要求重新进行鉴定。根据吉林省高级人民法院2009年第29号文件第五条“各级人民法院要严格掌握重新鉴定条件，经人民法院委托已做过一次司法鉴定的，合议庭应当组织开庭，鉴定人应当出庭质证或答疑，对质证或答疑仍有疑问的，合议庭应委托进行鉴定咨询，对符合《最高人民法院民事诉讼证据若干规定》第二十七条之规定条件的，经合议庭认为应重新鉴定的，且鉴定所需材料齐全，方可启动二次司法鉴定”的规定，法院组织了开庭，鉴定人出庭进行了质证及答疑，但倪磊仍有疑问，申请鉴定咨询，经委托鉴定咨询，鉴定咨询结论意见：“1、诊断及治疗存在过失；2、缺乏无过错资料；3、治疗前缺乏准确评价；4、诊断及治疗不一致；5、其治疗过程使患者失去最佳救治机会并加重病人的病情；6、无需提起二次鉴定。”庭审结束后，因洪锦秀系回族，其在江苏省原籍进行了土葬。倪磊又申请对洪锦秀的尸体解剖，因司法鉴定及鉴定咨询均明确了倪磊的医疗活动存在过错，故不启动二次鉴定程序及不准予其要求尸体解剖的申请。根据当事人提交的2009年5月11日通化市卫生局出具的《关于患者洪锦秀医疗纠纷事件的几点说明》，能证明倪磊在为洪锦秀诊疗期间其执业医师没有变更注册，也未将通化市中心医院执业地点变更到倪磊西医内科诊所。
通化市东昌区人民法院一审认为，倪磊应当依照医疗卫生管理法律、行政法规、部门规章从事医疗活动并按照诊疗护理规范、常规对患者进行诊疗。但倪磊违反了医疗卫生管理法律、行政法规、部门规章，在未经注册取得执业医师证书，亦未办理医师变更执业地点的变更注册手续前从事医疗活动（已两次受到卫生行政部门停业整顿及停止一切医疗活动的处理），于2008年3月8日收留患者洪锦秀在其处诊疗。在缺少实验室检查依据准确评价的情况下，为患者洪锦秀诊断、用药。至3月25日才为患者洪锦秀进行血清检验，3月26日检验报告出具后，为患者洪锦秀转院。倪磊在为患者洪锦秀诊疗期间违反了诊疗护理规范、常规，缺乏诊断依据、用药不规范、诊断及治疗不一致，其治疗过程使患者洪锦秀失去最佳救治机会并加重患者洪锦秀的病情，致使患者洪锦秀于3月29日因抢救无效死亡。倪磊的医疗活动存在过失。由于其不能提供患者洪锦秀在其处诊疗的客观资料，导致无法进行医疗事故技术鉴定，不能就医疗行为与损害结果之间不存在因果关系及不存在医疗过错提供证据，应当承担不利后果。故不能参照《医疗事故处理条例》进行处理。倪磊应当按照《中华人民共和国民法通则》的相关规定承担医疗过失致人损害的民事赔偿责任。患者洪锦秀自身患有多种疾病，倪磊虽然存在医疗过错，但不能证明其过错是患者直接死亡的原因，因此倪磊应当承担次要责任。徐艳秋、徐晖主张的精神抚慰金的请求不予支持。东昌区人民法院于2009年8月25日作出（2008）东江西民初字第276号民事判决：（一）被告倪磊于本判决生效后立即赔偿原告徐艳秋、徐晖请求的合理费用124468.44元的40％即49787.38元。（二）驳回原告徐艳秋、徐晖的其他诉讼请求。案件受理费3300元（徐艳秋、徐晖交纳），由徐艳秋、徐晖负担1980元，倪磊负担1320元；倪磊交纳的鉴定人出庭费用900元、鉴定咨询费1500元，徐艳秋、徐晖负担1440元，倪磊负担960元。
徐艳秋、徐晖、倪磊均不服一审判决，向通化市中级人民法院提起上诉。
通化市中级人民法院二审查明的事实与一审判决认定的事实基本一致。
通化市中级人民法院二审认为，倪磊提供的执业医师证、医师资格认定申请审核表、医疗机构执业许可证等证据可证明其具有执业医师资格，在省卫生厅注册以及经卫生行政部门核准登记经营个体诊所，徐艳秋、徐晖主张倪磊非法行医并导致患者洪锦秀死亡要求承担全责，缺乏事实和法律依据，不予支持。医疗行为侵权责任的构成要件，包括诊疗行为、患者的损害、二者之间的因果关系和医疗过错。洪锦秀先在诊所治疗，几天后好转回家治疗，又回到诊所治疗，后在转入中心医院治疗期间死亡，因未尸检，死亡的具体原因不明确，因而倪磊西医诊所的医疗行为与洪锦秀死亡后果之间的因果关系无法确定。另外，洪锦秀不是在诊所治疗过程中死亡，受害人一方又表示不要求中心医院承担责任，而划定赔偿责任应综合考虑医疗过失行为在损害后果中的责任程度、损害与患者原有疾病状况之间的关系等因素，不能简单归责于一方。原审判令倪磊承担责任的主要依据是大众司法所出具的鉴定意见书和专家听证的意见，虽指出倪磊诊所对患者诊断依据不足、用药属不规范、缺少实验室检查结果支持等问题，但对如何违规、违反哪些规定，未予明确。此鉴定是在无法鉴定因果关系及过错责任程度的情况下，对诊所医疗行为有无过错指出的鉴定。倪磊否认患者在其诊所住院治疗，而是门诊治疗，无强制性规定门诊治疗要建立病历档案，且倪磊提供患者家属出具的证据证明，相关检查资料交给了家属，原审以诊所不能提供诊疗客观资料，导致不能证明因果关系而承担不利后果欠妥。关于诊所为患者用药是否规范，患者入住中心医院后仍使用鉴定认为诊所不合理使用的硝普钠，也无化验单等充分证据证明诊所使用该药物导致患者中毒以及损害程度。根据中心医院病历记载，患者患有冠心病等，未言明中毒。鉴定认为用药不规范，硝普钠可引起血浆氰化物和硫氰化物浓度升高而中毒，应慎用。但只是说可以引起，并没有说必然引起或已因此中毒。从病历看，入院检查结果和诊断没有体现诊断酸中毒。病程记录体现3月28日临床诊断有酸中毒症状，而患者入住中心医院后也是使用硝普钠药物治疗，诊所和医院都使用了硝普钠，如何引起中毒、是不是硝普钠引起中毒，是否中毒导致死亡，没有确切证据支持。综上，可以确定洪锦秀死亡的事实和倪磊从事医疗活动存在一定过错，但无充分证据证明洪锦秀的死亡与倪磊的治疗行为有直接的因果关系，倪磊应在其过错范围内适当赔偿受害人的损失。倪磊系个体私营，原审判令倪磊承担责任，但赔偿比例过高，应予改判。通化市中级人民法院于2011年12月22日作出（2009）通中民一终字第319号民事判决：（一）撤销通化市东昌区人民法院（2008）东江西民初字第276号民事判决。（二）倪磊立即赔偿徐艳秋、徐晖死亡赔偿金、医疗费、护理费、住院伙食补助费、丧葬费、鉴定费合计124468.44元的20％，即24893.69元。（三）驳回双方当事人的其他诉讼请求。一、二审案件受理费6737元，徐艳秋、徐晖负担5390元，倪磊负担1347元；鉴定人出庭费用900元、鉴定咨询费1500元，徐艳秋、徐晖负担1920元，倪磊负担480元。
徐艳秋不服二审判决，向本院申请再审称，二审判决认定事实错误，适用法律不当。（一）倪磊属于非法行医，具有严重违法性。（二）倪磊造成患者洪锦秀死亡的事实，存在完全的医疗过错。（三）根据举证责任分配原则，也可以推定倪磊应负完全赔偿责任。（四）洪锦秀没有尸检，不影响对倪磊医疗责任的认定。请求：撤销原审判决，改判倪磊赔偿徐艳秋医疗损害损失124468.44元。
被申请人倪磊辩称，洪锦秀的死亡与我方治疗无因果关系，且我方对其治疗，未给其造成损害、无过错，不应承担赔偿责任。（一）洪锦秀病危、死亡均发生于案件第三方DD通化市中心医院治疗过程中，与我方治疗无因果关系。（二）拒绝放弃治疗是洪锦秀死亡的直接原因，其死亡与我方治疗无因果关系。（三）洪锦秀死亡后，其家属拒绝尸检，应推定患者死亡与我方治疗无因果关系。（四）现有《鉴定意见书》鉴定范围不完整，且不客观、不真实，不应作为本案定案依据。
本院再审查明的案件事实与原审判决认定的事实基本一致。
本院再审认为，倪磊对患者洪锦秀的死亡应承担医疗损害赔偿责任。理由为：1.根据通化市卫生局出具的《说明》及当事人的法庭陈述，可以认定倪磊在为洪锦秀治疗期间，并没有进行合法有效的执业医师注册，其执业地点也没有进行变更注册，违反了医疗管理的法律法规，其诊疗活动属违规行为。2.原审法院审理时，根据当事人的申请，按照法律规定的程序组织了鉴定。鉴定机构应用专业知识，作出了真实、有效的《司法鉴定意见书》。由于倪磊对该鉴定意见有异议，原审法院又组织了鉴定人出庭质证和鉴定咨询，均没有否认鉴定结果。根据《中国人民共和国民事诉讼法》及《民事诉讼证据规则》的相关规定，合法、有效的鉴定结论可作为证据，原审法院采信《司法鉴定意见书》作为证据使用并无不当。3.根据《司法鉴定意见书》的鉴定结论，倪磊对洪锦秀的医疗行为存在过错。根据《中华人民共和国侵权责任法》第五十四条：“患者在诊疗活动中受到损害，医疗机构及其医务人员有过错的，由医疗机构承担赔偿责任”，患者洪锦秀经过倪磊的治疗病危并最终死亡，倪磊的医疗行为有过错，就应承担侵权赔偿责任。4.由于倪磊在原审法院对其证据保全时，不能举出病例等医疗材料，导致无法进行因果关系及医疗事故的司法鉴定，倪磊应承担举证不能的不利后果。5.洪锦秀死亡后虽没有进行尸检，但其在倪磊处治疗，昏迷后送中心医院抢救，三天后死亡是事实，倪磊不能排除医疗责任。
徐艳秋和徐晖作为患者洪锦秀的家属，对其死亡也有过错。1.家属自愿将患者洪锦秀送到倪磊处治疗，没有认真审查倪磊的医疗资质。2.洪锦秀在通化市中心医院治疗抢救时，徐艳秋和徐晖曾有放弃治疗的行为，放任了洪锦秀的死亡。3.洪锦秀死亡后，其家属拒绝尸检，导致无法确认洪锦秀的真正死因。4.洪锦秀虽经倪磊治疗，但最终是在通化市中心医院抢救并死亡的，而徐艳秋和徐晖并没有起诉通化市中心医院，只起诉倪磊，不利于查清事实，分担责任。
综上，原二审判决倪磊承担20％责任，死者家属承担80％责任，明显不合理，有失公平，应予纠正。倪磊对洪锦秀的死亡有过错，应承担医疗损害赔偿责任。而徐艳秋和徐晖也有过错，并且没有直接证据证明倪磊的医疗行为导致了洪锦秀的必然死亡，无法确认两者是否存在因果关系，故徐艳秋和徐晖作为死者的家属也应承担部分责任。根据《中华人民共和国民法通则》、《中华人民共和国侵权责任法》的相关规定，双方当事人应分担洪锦秀死亡的赔偿责任，各方承担50%为宜。因此，徐艳秋的再审请求应予支持，案件应改判，倪磊应赔偿徐艳秋和徐晖主张的各项合理赔偿费用总额124468.44元的50％，即62234.22元。
依照《中华人民共和国民事诉讼法》第二百零七条第一款、第一百七十条第一款第（二）项的规定，判决如下：
一、撤销通化市中级人民法院（2009）通中民一终字第319号民事判决及通化市东昌区人民法院（2008）东江西民初字第276号民事判决。
二、倪磊于判决生效后10日内给付徐艳秋、徐晖死亡赔偿金、医疗费、护理费、住院伙食补助费、丧葬费、鉴定费合计124468.44元的50％，即62234.22元。
如果未按本判决指定的期间履行给付金钱义务，应当依照《中华人民共和国民事诉讼法》第二百五十三条之规定，加倍支付迟延履行期间的债务利息。
一、二审案件受理费6737元，徐艳秋、徐晖负担3368.50元，倪磊负担3368.50元；鉴定人出庭费用900元、鉴定咨询费1500元，徐艳秋、徐晖负担1200元，倪磊负担1200元。
本判决为终审判决。
审　判　长　　冯志义
代理审判员　　王鹏才
代理审判员　　陆海权

二一四年十月三十一日
书　记　员　　于　h"
